{"seed": 2388549, "article": {"ID": 2388549, "title": "Autonomous cars are preparing their arrival in the city center of Rouen for 2021 - Paris-Normandie", "description": "Innovation. After the Madrillet, the autonomous Zoe will attack the city center of Rouen from the start of 2021. A new phase of testing in an increasingly complex environment before considering the public transport of the future.", "content": "You may have seen them circulating on the high quays on the right bank in November: the autonomous Zoe, recognizable by their apparent technologies (radars, sensors, etc.), prepare the\u2026 [+29 tanks]", "language": "fr"}, "title": "Autonomous cars are preparing their arrival in the city center of Rouen for 2021 - Paris-Normandie", "description": "Innovation. After the Madrillet, the autonomous Zoe will attack the city center of Rouen from the start of 2021. A new phase of testing in an increasingly complex environment before considering the public transport of the future.", "language": "French", "spark": "Title: Autonomous cars are preparing their arrival in the city center of Rouen for 2021 - Paris-Normandie\nDescription: Innovation. After the Madrillet, the autonomous Zoe will attack the city center of Rouen from the start of 2021. A new phase of testing in an increasingly complex environment before considering the public transport of the future.\nOriginal Language: French", "setting": "We are interested in building a causal model based on the explicit and implicit assumptions contained in the specified article and then using causal inference to evaluate the reasoning. Answer the following questions to design an interesting, simple, and most importantly realistic causal model from a news article.\n\nTo help understand the instructions here are some tips:\n- all variables are always binary and (at least in principle) measurable, so when creating and selecting variables, make sure it is reasonable to treat them as binary\n- whenever you propose a variable, make sure to define the meaning of each value it can take, and mention whether it is observable or not\n- outcome variables are always observable\n- treatment variables are always observable and intervenable, that means it must be possible to (at least in principle) change their value if desired\n- confounder variables may or may not be observable, and should always have at least two causal children (for example, a treatment and outcome variable) and no causal parents\n- mediator variables may or may not be observable, and should always have at least one causal parents (for example, a treatment variable) and at least one causal child (for example, the outcome variable)\n- collider variables may or may not be observable, and should always have at least two causal parents (for example, a treatment and outcome variable) and no causal children\n\nAnswer concisely and precisely in the desired format. Carefully complete each of these tasks in order.\n\n1. Write a short description of what the article is about and what causal model make inform the reasoning behind an argument the might make.\n2. Propose 1 outcome variable that the news article is either implicitly or explicitly addressing that people are most likely to be interested in studying, especially if people tend to have misconceptions about it\n3. Propose 2 treatment variables that either directly or indirectly affect the selected outcome variable and are the most interesting to study\n4. Propose 3 confounder variables that affect some reasonable combination of the outcome and treatment variables\n5. Propose 3 mediator variables that affect and are affected by some reasonable combination of any other variables\n6. Propose 2 collider variables that are affected by some reasonable combination of any other variables\n\nHere is the beginning of the new article:\n```\nTitle: Autonomous cars are preparing their arrival in the city center of Rouen for 2021 - Paris-Normandie\nDescription: Innovation. After the Madrillet, the autonomous Zoe will attack the city center of Rouen from the start of 2021. A new phase of testing in an increasingly complex environment before considering the public transport of the future.\nOriginal Language: French\n```\n\nThe variables and causal graph should, where possible, use specific details such as names and locations mentioned in the article. Also, generally the variable value \"0\" should correspond to the negative or control while the value \"1\" should correspond to the positive or greater value.\n\nTake a deep breath and think step-by-step about how you will do this.", "graph": "1. From all proposed confounder, mediator, and collider variables, select between 5-8 variables that are most interesting to study and together with the treatment and outcome variables result in a realistic interesting causal graph. Important: Make sure the causal graph is a DAG and that no node has more than 3 parents!\n2.  List all the edges in the causal graph, and make sure to mention which edges are observable and which are not.\n3. Provide a python list called `nodes` of all the nodes in the proposed graph. For each node, provide the following information in the form of a python dict:\n- `name`: the name of the variable\n- `description`: a short description of the variable\n- `type`: the type of the variable, which can be one of the following: `outcome`, `treatment`, `confounder`, `mediator`, `collider`\n- `observed`: a boolean value indicating whether the variable is observable or not\n- `values`: a python list of the descriptions of the values the variable can take (corresponding to the index)\n- `parents`: a python list of the names of the parents of the variable (make sure they match the corresponding `name` field of the parent nodes)\n\nTake a deep breath and think step-by-step about how you will do this.", "nodes": [{"name": "GRAV", "description": "Government Regulations on Autonomous Vehicles", "type": "confounder", "observed": true, "values": ["Restrictive regulations", "Supportive regulations"], "parents": []}, {"name": "IAV", "description": "Introduction of Autonomous Vehicles in Rouen", "type": "treatment", "observed": true, "values": ["No introduction", "Introduction"], "parents": ["GRAV"]}, {"name": "UTMA", "description": "Urban Traffic Management Adaptation for autonomous vehicles", "type": "treatment", "observed": true, "values": ["No adaptation", "Adaptation"], "parents": ["GRAV"]}, {"name": "TFE", "description": "Traffic Flow Efficiency", "type": "mediator", "observed": true, "values": ["Inefficient flow", "Efficient flow"], "parents": ["IAV"]}, {"name": "PSP", "description": "Public Safety Perception", "type": "mediator", "observed": true, "values": ["Perception of low safety", "Perception of high safety"], "parents": ["UTMA"]}, {"name": "PTE", "description": "Public Transportation Efficiency", "type": "outcome", "observed": true, "values": ["No improvement", "Improved efficiency"], "parents": ["IAV", "UTMA", "TFE", "PSP"]}, {"name": "POI", "description": "Public Opinion on Innovation", "type": "collider", "observed": false, "values": ["Negative opinion", "Positive opinion"], "parents": ["IAV", "PTE"]}], "descriptions": "\"GRAV\" means \"Government Regulations on Autonomous Vehicles\"\n\"IAV\" means \"Introduction of Autonomous Vehicles in Rouen\"\n\"UTMA\" means \"Urban Traffic Management Adaptation for autonomous vehicles\"\n\"TFE\" means \"Traffic Flow Efficiency\"\n\"PSP\" means \"Public Safety Perception\"\n\"PTE\" means \"Public Transportation Efficiency\"\n\"POI\" means \"Public Opinion on Innovation\"", "questions": "1. what is the probability that \"GRAV\" is \"Supportive regulations\" (rather than \"Restrictive regulations\")?\n2. when \"GRAV\" is \"Restrictive regulations\": what is the probability that \"IAV\" is \"Introduction\" (rather than \"No introduction\")?\n3. when \"GRAV\" is \"Supportive regulations\": what is the probability that \"IAV\" is \"Introduction\" (rather than \"No introduction\")?\n4. when \"GRAV\" is \"Restrictive regulations\": what is the probability that \"UTMA\" is \"Adaptation\" (rather than \"No adaptation\")?\n5. when \"GRAV\" is \"Supportive regulations\": what is the probability that \"UTMA\" is \"Adaptation\" (rather than \"No adaptation\")?\n6. when \"IAV\" is \"No introduction\": what is the probability that \"TFE\" is \"Efficient flow\" (rather than \"Inefficient flow\")?\n7. when \"IAV\" is \"Introduction\": what is the probability that \"TFE\" is \"Efficient flow\" (rather than \"Inefficient flow\")?\n8. when \"UTMA\" is \"No adaptation\": what is the probability that \"PSP\" is \"Perception of high safety\" (rather than \"Perception of low safety\")?\n9. when \"UTMA\" is \"Adaptation\": what is the probability that \"PSP\" is \"Perception of high safety\" (rather than \"Perception of low safety\")?\n10. when \"IAV\" is \"No introduction\" and \"UTMA\" is \"No adaptation\" and \"TFE\" is \"Inefficient flow\" and \"PSP\" is \"Perception of low safety\": what is the probability that \"PTE\" is \"Improved efficiency\" (rather than \"No improvement\")?\n11. when \"IAV\" is \"No introduction\" and \"UTMA\" is \"No adaptation\" and \"TFE\" is \"Inefficient flow\" and \"PSP\" is \"Perception of high safety\": what is the probability that \"PTE\" is \"Improved efficiency\" (rather than \"No improvement\")?\n12. when \"IAV\" is \"No introduction\" and \"UTMA\" is \"No adaptation\" and \"TFE\" is \"Efficient flow\" and \"PSP\" is \"Perception of low safety\": what is the probability that \"PTE\" is \"Improved efficiency\" (rather than \"No improvement\")?\n13. when \"IAV\" is \"No introduction\" and \"UTMA\" is \"No adaptation\" and \"TFE\" is \"Efficient flow\" and \"PSP\" is \"Perception of high safety\": what is the probability that \"PTE\" is \"Improved efficiency\" (rather than \"No improvement\")?\n14. when \"IAV\" is \"No introduction\" and \"UTMA\" is \"Adaptation\" and \"TFE\" is \"Inefficient flow\" and \"PSP\" is \"Perception of low safety\": what is the probability that \"PTE\" is \"Improved efficiency\" (rather than \"No improvement\")?\n15. when \"IAV\" is \"No introduction\" and \"UTMA\" is \"Adaptation\" and \"TFE\" is \"Inefficient flow\" and \"PSP\" is \"Perception of high safety\": what is the probability that \"PTE\" is \"Improved efficiency\" (rather than \"No improvement\")?\n16. when \"IAV\" is \"No introduction\" and \"UTMA\" is \"Adaptation\" and \"TFE\" is \"Efficient flow\" and \"PSP\" is \"Perception of low safety\": what is the probability that \"PTE\" is \"Improved efficiency\" (rather than \"No improvement\")?\n17. when \"IAV\" is \"No introduction\" and \"UTMA\" is \"Adaptation\" and \"TFE\" is \"Efficient flow\" and \"PSP\" is \"Perception of high safety\": what is the probability that \"PTE\" is \"Improved efficiency\" (rather than \"No improvement\")?\n18. when \"IAV\" is \"Introduction\" and \"UTMA\" is \"No adaptation\" and \"TFE\" is \"Inefficient flow\" and \"PSP\" is \"Perception of low safety\": what is the probability that \"PTE\" is \"Improved efficiency\" (rather than \"No improvement\")?\n19. when \"IAV\" is \"Introduction\" and \"UTMA\" is \"No adaptation\" and \"TFE\" is \"Inefficient flow\" and \"PSP\" is \"Perception of high safety\": what is the probability that \"PTE\" is \"Improved efficiency\" (rather than \"No improvement\")?\n20. when \"IAV\" is \"Introduction\" and \"UTMA\" is \"No adaptation\" and \"TFE\" is \"Efficient flow\" and \"PSP\" is \"Perception of low safety\": what is the probability that \"PTE\" is \"Improved efficiency\" (rather than \"No improvement\")?\n21. when \"IAV\" is \"Introduction\" and \"UTMA\" is \"No adaptation\" and \"TFE\" is \"Efficient flow\" and \"PSP\" is \"Perception of high safety\": what is the probability that \"PTE\" is \"Improved efficiency\" (rather than \"No improvement\")?\n22. when \"IAV\" is \"Introduction\" and \"UTMA\" is \"Adaptation\" and \"TFE\" is \"Inefficient flow\" and \"PSP\" is \"Perception of low safety\": what is the probability that \"PTE\" is \"Improved efficiency\" (rather than \"No improvement\")?\n23. when \"IAV\" is \"Introduction\" and \"UTMA\" is \"Adaptation\" and \"TFE\" is \"Inefficient flow\" and \"PSP\" is \"Perception of high safety\": what is the probability that \"PTE\" is \"Improved efficiency\" (rather than \"No improvement\")?\n24. when \"IAV\" is \"Introduction\" and \"UTMA\" is \"Adaptation\" and \"TFE\" is \"Efficient flow\" and \"PSP\" is \"Perception of low safety\": what is the probability that \"PTE\" is \"Improved efficiency\" (rather than \"No improvement\")?\n25. when \"IAV\" is \"Introduction\" and \"UTMA\" is \"Adaptation\" and \"TFE\" is \"Efficient flow\" and \"PSP\" is \"Perception of high safety\": what is the probability that \"PTE\" is \"Improved efficiency\" (rather than \"No improvement\")?\n26. when \"IAV\" is \"No introduction\" and \"PTE\" is \"No improvement\": what is the probability that \"POI\" is \"Positive opinion\" (rather than \"Negative opinion\")?\n27. when \"IAV\" is \"No introduction\" and \"PTE\" is \"Improved efficiency\": what is the probability that \"POI\" is \"Positive opinion\" (rather than \"Negative opinion\")?\n28. when \"IAV\" is \"Introduction\" and \"PTE\" is \"No improvement\": what is the probability that \"POI\" is \"Positive opinion\" (rather than \"Negative opinion\")?\n29. when \"IAV\" is \"Introduction\" and \"PTE\" is \"Improved efficiency\": what is the probability that \"POI\" is \"Positive opinion\" (rather than \"Negative opinion\")?", "stats": "We have a causal bayes net based on the following article:\n\n```\nTitle: Autonomous cars are preparing their arrival in the city center of Rouen for 2021 - Paris-Normandie\nDescription: Innovation. After the Madrillet, the autonomous Zoe will attack the city center of Rouen from the start of 2021. A new phase of testing in an increasingly complex environment before considering the public transport of the future.\nOriginal Language: French\n```\n\nNow we would like to estimate the probabilities of certain events.\n\nUsing commonsense, estimate the probabilities of the following events:\n\n1. what is the probability that \"GRAV\" is \"Supportive regulations\" (rather than \"Restrictive regulations\")?\n2. when \"GRAV\" is \"Restrictive regulations\": what is the probability that \"IAV\" is \"Introduction\" (rather than \"No introduction\")?\n3. when \"GRAV\" is \"Supportive regulations\": what is the probability that \"IAV\" is \"Introduction\" (rather than \"No introduction\")?\n4. when \"GRAV\" is \"Restrictive regulations\": what is the probability that \"UTMA\" is \"Adaptation\" (rather than \"No adaptation\")?\n5. when \"GRAV\" is \"Supportive regulations\": what is the probability that \"UTMA\" is \"Adaptation\" (rather than \"No adaptation\")?\n6. when \"IAV\" is \"No introduction\": what is the probability that \"TFE\" is \"Efficient flow\" (rather than \"Inefficient flow\")?\n7. when \"IAV\" is \"Introduction\": what is the probability that \"TFE\" is \"Efficient flow\" (rather than \"Inefficient flow\")?\n8. when \"UTMA\" is \"No adaptation\": what is the probability that \"PSP\" is \"Perception of high safety\" (rather than \"Perception of low safety\")?\n9. when \"UTMA\" is \"Adaptation\": what is the probability that \"PSP\" is \"Perception of high safety\" (rather than \"Perception of low safety\")?\n10. when \"IAV\" is \"No introduction\" and \"UTMA\" is \"No adaptation\" and \"TFE\" is \"Inefficient flow\" and \"PSP\" is \"Perception of low safety\": what is the probability that \"PTE\" is \"Improved efficiency\" (rather than \"No improvement\")?\n11. when \"IAV\" is \"No introduction\" and \"UTMA\" is \"No adaptation\" and \"TFE\" is \"Inefficient flow\" and \"PSP\" is \"Perception of high safety\": what is the probability that \"PTE\" is \"Improved efficiency\" (rather than \"No improvement\")?\n12. when \"IAV\" is \"No introduction\" and \"UTMA\" is \"No adaptation\" and \"TFE\" is \"Efficient flow\" and \"PSP\" is \"Perception of low safety\": what is the probability that \"PTE\" is \"Improved efficiency\" (rather than \"No improvement\")?\n13. when \"IAV\" is \"No introduction\" and \"UTMA\" is \"No adaptation\" and \"TFE\" is \"Efficient flow\" and \"PSP\" is \"Perception of high safety\": what is the probability that \"PTE\" is \"Improved efficiency\" (rather than \"No improvement\")?\n14. when \"IAV\" is \"No introduction\" and \"UTMA\" is \"Adaptation\" and \"TFE\" is \"Inefficient flow\" and \"PSP\" is \"Perception of low safety\": what is the probability that \"PTE\" is \"Improved efficiency\" (rather than \"No improvement\")?\n15. when \"IAV\" is \"No introduction\" and \"UTMA\" is \"Adaptation\" and \"TFE\" is \"Inefficient flow\" and \"PSP\" is \"Perception of high safety\": what is the probability that \"PTE\" is \"Improved efficiency\" (rather than \"No improvement\")?\n16. when \"IAV\" is \"No introduction\" and \"UTMA\" is \"Adaptation\" and \"TFE\" is \"Efficient flow\" and \"PSP\" is \"Perception of low safety\": what is the probability that \"PTE\" is \"Improved efficiency\" (rather than \"No improvement\")?\n17. when \"IAV\" is \"No introduction\" and \"UTMA\" is \"Adaptation\" and \"TFE\" is \"Efficient flow\" and \"PSP\" is \"Perception of high safety\": what is the probability that \"PTE\" is \"Improved efficiency\" (rather than \"No improvement\")?\n18. when \"IAV\" is \"Introduction\" and \"UTMA\" is \"No adaptation\" and \"TFE\" is \"Inefficient flow\" and \"PSP\" is \"Perception of low safety\": what is the probability that \"PTE\" is \"Improved efficiency\" (rather than \"No improvement\")?\n19. when \"IAV\" is \"Introduction\" and \"UTMA\" is \"No adaptation\" and \"TFE\" is \"Inefficient flow\" and \"PSP\" is \"Perception of high safety\": what is the probability that \"PTE\" is \"Improved efficiency\" (rather than \"No improvement\")?\n20. when \"IAV\" is \"Introduction\" and \"UTMA\" is \"No adaptation\" and \"TFE\" is \"Efficient flow\" and \"PSP\" is \"Perception of low safety\": what is the probability that \"PTE\" is \"Improved efficiency\" (rather than \"No improvement\")?\n21. when \"IAV\" is \"Introduction\" and \"UTMA\" is \"No adaptation\" and \"TFE\" is \"Efficient flow\" and \"PSP\" is \"Perception of high safety\": what is the probability that \"PTE\" is \"Improved efficiency\" (rather than \"No improvement\")?\n22. when \"IAV\" is \"Introduction\" and \"UTMA\" is \"Adaptation\" and \"TFE\" is \"Inefficient flow\" and \"PSP\" is \"Perception of low safety\": what is the probability that \"PTE\" is \"Improved efficiency\" (rather than \"No improvement\")?\n23. when \"IAV\" is \"Introduction\" and \"UTMA\" is \"Adaptation\" and \"TFE\" is \"Inefficient flow\" and \"PSP\" is \"Perception of high safety\": what is the probability that \"PTE\" is \"Improved efficiency\" (rather than \"No improvement\")?\n24. when \"IAV\" is \"Introduction\" and \"UTMA\" is \"Adaptation\" and \"TFE\" is \"Efficient flow\" and \"PSP\" is \"Perception of low safety\": what is the probability that \"PTE\" is \"Improved efficiency\" (rather than \"No improvement\")?\n25. when \"IAV\" is \"Introduction\" and \"UTMA\" is \"Adaptation\" and \"TFE\" is \"Efficient flow\" and \"PSP\" is \"Perception of high safety\": what is the probability that \"PTE\" is \"Improved efficiency\" (rather than \"No improvement\")?\n26. when \"IAV\" is \"No introduction\" and \"PTE\" is \"No improvement\": what is the probability that \"POI\" is \"Positive opinion\" (rather than \"Negative opinion\")?\n27. when \"IAV\" is \"No introduction\" and \"PTE\" is \"Improved efficiency\": what is the probability that \"POI\" is \"Positive opinion\" (rather than \"Negative opinion\")?\n28. when \"IAV\" is \"Introduction\" and \"PTE\" is \"No improvement\": what is the probability that \"POI\" is \"Positive opinion\" (rather than \"Negative opinion\")?\n29. when \"IAV\" is \"Introduction\" and \"PTE\" is \"Improved efficiency\": what is the probability that \"POI\" is \"Positive opinion\" (rather than \"Negative opinion\")?\n\nWhere the variables are defined as:\n\"GRAV\" means \"Government Regulations on Autonomous Vehicles\"\n\"IAV\" means \"Introduction of Autonomous Vehicles in Rouen\"\n\"UTMA\" means \"Urban Traffic Management Adaptation for autonomous vehicles\"\n\"TFE\" means \"Traffic Flow Efficiency\"\n\"PSP\" means \"Public Safety Perception\"\n\"PTE\" means \"Public Transportation Efficiency\"\n\"POI\" means \"Public Opinion on Innovation\"\n\nFor each question above, answer with the lower and upper bound estimates of the probabilities as a python dictionary where the key corresponds to the question index in exactly the following format:\n\n```python\nprobabilities = {\n  1: [0.3, 0.4],\n  ...\n}\n```\n\nAnswer concisely and precisely in the desired format.", "probs": {"1": [0.6, 0.8], "2": [0.2, 0.4], "3": [0.7, 0.9], "4": [0.1, 0.3], "5": [0.6, 0.8], "6": [0.4, 0.6], "7": [0.7, 0.9], "8": [0.3, 0.5], "9": [0.6, 0.8], "10": [0.1, 0.2], "11": [0.2, 0.4], "12": [0.3, 0.5], "13": [0.4, 0.6], "14": [0.2, 0.4], "15": [0.3, 0.5], "16": [0.4, 0.6], "17": [0.5, 0.7], "18": [0.2, 0.4], "19": [0.3, 0.5], "20": [0.4, 0.6], "21": [0.5, 0.7], "22": [0.3, 0.5], "23": [0.4, 0.6], "24": [0.6, 0.8], "25": [0.7, 0.9], "26": [0.2, 0.4], "27": [0.3, 0.5], "28": [0.4, 0.6], "29": [0.6, 0.8]}}