{"seed": 5393081, "article": {"ID": 5393081, "title": "Covid-19. Record deaths in Moscow, Russia overtaken by the delta variant - Ouest-France", "description": null, "content": null, "language": "fr"}, "title": "Covid-19. Record deaths in Moscow, Russia overtaken by the delta variant - Ouest-France", "language": "French", "spark": "Title: Covid-19. Record deaths in Moscow, Russia overtaken by the delta variant - Ouest-France\nDescription: None\nOriginal Language: French", "setting": "We are interested in building a causal model based on the explicit and implicit assumptions contained in the specified article and then using causal inference to evaluate the reasoning. Answer the following questions to design an interesting, simple, and most importantly realistic causal model from a news article.\n\nTo help understand the instructions here are some tips:\n- all variables are always binary and (at least in principle) measurable, so when creating and selecting variables, make sure it is reasonable to treat them as binary\n- whenever you propose a variable, make sure to define the meaning of each value it can take, and mention whether it is observable or not\n- outcome variables are always observable\n- treatment variables are always observable and intervenable, that means it must be possible to (at least in principle) change their value if desired\n- confounder variables may or may not be observable, and should always have at least two causal children (for example, a treatment and outcome variable) and no causal parents\n- mediator variables may or may not be observable, and should always have at least one causal parent (for example, a treatment variable) and at least one causal child (for example, the outcome variable)\n- collider variables may or may not be observable, and should always have at least two causal parents (for example, a treatment and outcome variable) and no causal children\n\nAnswer concisely and precisely in the desired format. Carefully complete each of these tasks in order.\n\n1. Write a short description of what the article is about and what causal model make inform the reasoning behind an argument the might make.\n2. Propose 1 outcome variable that the news article is either implicitly or explicitly addressing that people are most likely to be interested in studying, especially if people tend to have misconceptions about it\n3. Propose 2 treatment variables that either directly or indirectly affect the selected outcome variable and are the most interesting to study\n4. Propose 3 confounder variables that affect some reasonable combination of the outcome and treatment variables\n5. Propose 3 mediator variables that affect and are affected by some reasonable combination of any other variables\n6. Propose 2 collider variables that are affected by some reasonable combination of any other variables\n\nHere is the beginning of the news article:\n```\nTitle: Covid-19. Record deaths in Moscow, Russia overtaken by the delta variant - Ouest-France\nDescription: None\nOriginal Language: French\n```\n\nThe variables and causal graph should, where possible, use specific details such as names and locations mentioned in the article. Also, generally the variable value \"0\" should correspond to the negative, neutral, or control while the value \"1\" should correspond to the positive choice or active value.\n\nTake a deep breath and think step-by-step about how you will do this.", "graph": "1. From all proposed confounder, mediator, and collider variables, select between 4-6 variables that are most interesting to study and together with the treatment and outcome variables result in a realistic interesting causal graph. Important: Make sure the causal graph is a DAG and that no node has more than 3 parents!\n2.  List all the edges in the causal graph, and make sure to mention which edges are observable and which are not.\n3. Provide a python list called `nodes` of all the nodes in the proposed graph. For each node, provide the following information in the form of a python dict:\n- `name`: the name of the variable\n- `description`: a short description of the variable\n- `type`: the type of the variable, which can be one of the following: `outcome`, `treatment`, `confounder`, `mediator`, `collider`\n- `observed`: a boolean value indicating whether the variable is observable or not\n- `values`: a python list of the descriptions of the values the variable can take (corresponding to the index)\n- `parents`: a python list of the names of the parents of the variable (make sure they match the corresponding `name` field of the parent nodes, and remember, there should not be more than 3 parents for any node)\n\nTake a deep breath and think step-by-step about how you will do this.", "nodes": [{"name": "Economic Status of Moscow", "description": "Economic status and resources of Moscow", "type": "confounder", "observed": true, "values": ["Poor economic status", "Good economic status"], "parents": []}, {"name": "Vaccination Rate in Moscow", "description": "Vaccination rate against Covid-19 in Moscow", "type": "treatment", "observed": true, "values": ["Low vaccination rate", "High vaccination rate"], "parents": ["Economic Status of Moscow"]}, {"name": "Healthcare System Capacity", "description": "Capacity and efficiency of healthcare system in Moscow", "type": "confounder", "observed": false, "values": ["Inadequate capacity", "Adequate capacity"], "parents": ["Economic Status of Moscow"]}, {"name": "Implementation of Public Health Measures", "description": "Effectiveness of public health measures in Moscow", "type": "treatment", "observed": true, "values": ["No or poor implementation", "Effective implementation"], "parents": ["Healthcare System Capacity"]}, {"name": "Access to Healthcare", "description": "Access to healthcare services in Moscow", "type": "mediator", "observed": true, "values": ["Limited access", "Wide access"], "parents": ["Healthcare System Capacity"]}, {"name": "Covid-19 Mortality in Moscow", "description": "Mortality rate due to Covid-19 in Moscow", "type": "outcome", "observed": true, "values": ["Low mortality rate", "High mortality rate"], "parents": ["Implementation of Public Health Measures", "Vaccination Rate in Moscow", "Access to Healthcare"]}], "questions": "1. what is the probability that \"Economic Status of Moscow\" is \"Good economic status\" (rather than \"Poor economic status\")?\n2. when \"Economic Status of Moscow\" is \"Poor economic status\": what is the probability that \"Vaccination Rate in Moscow\" is \"High vaccination rate\" (rather than \"Low vaccination rate\")?\n3. when \"Economic Status of Moscow\" is \"Good economic status\": what is the probability that \"Vaccination Rate in Moscow\" is \"High vaccination rate\" (rather than \"Low vaccination rate\")?\n4. when \"Economic Status of Moscow\" is \"Poor economic status\": what is the probability that \"Healthcare System Capacity\" is \"Adequate capacity\" (rather than \"Inadequate capacity\")?\n5. when \"Economic Status of Moscow\" is \"Good economic status\": what is the probability that \"Healthcare System Capacity\" is \"Adequate capacity\" (rather than \"Inadequate capacity\")?\n6. when \"Healthcare System Capacity\" is \"Inadequate capacity\": what is the probability that \"Implementation of Public Health Measures\" is \"Effective implementation\" (rather than \"No or poor implementation\")?\n7. when \"Healthcare System Capacity\" is \"Adequate capacity\": what is the probability that \"Implementation of Public Health Measures\" is \"Effective implementation\" (rather than \"No or poor implementation\")?\n8. when \"Healthcare System Capacity\" is \"Inadequate capacity\": what is the probability that \"Access to Healthcare\" is \"Wide access\" (rather than \"Limited access\")?\n9. when \"Healthcare System Capacity\" is \"Adequate capacity\": what is the probability that \"Access to Healthcare\" is \"Wide access\" (rather than \"Limited access\")?\n10. when \"Implementation of Public Health Measures\" is \"No or poor implementation\" and \"Vaccination Rate in Moscow\" is \"Low vaccination rate\" and \"Access to Healthcare\" is \"Limited access\": what is the probability that \"Covid-19 Mortality in Moscow\" is \"High mortality rate\" (rather than \"Low mortality rate\")?\n11. when \"Implementation of Public Health Measures\" is \"No or poor implementation\" and \"Vaccination Rate in Moscow\" is \"Low vaccination rate\" and \"Access to Healthcare\" is \"Wide access\": what is the probability that \"Covid-19 Mortality in Moscow\" is \"High mortality rate\" (rather than \"Low mortality rate\")?\n12. when \"Implementation of Public Health Measures\" is \"No or poor implementation\" and \"Vaccination Rate in Moscow\" is \"High vaccination rate\" and \"Access to Healthcare\" is \"Limited access\": what is the probability that \"Covid-19 Mortality in Moscow\" is \"High mortality rate\" (rather than \"Low mortality rate\")?\n13. when \"Implementation of Public Health Measures\" is \"No or poor implementation\" and \"Vaccination Rate in Moscow\" is \"High vaccination rate\" and \"Access to Healthcare\" is \"Wide access\": what is the probability that \"Covid-19 Mortality in Moscow\" is \"High mortality rate\" (rather than \"Low mortality rate\")?\n14. when \"Implementation of Public Health Measures\" is \"Effective implementation\" and \"Vaccination Rate in Moscow\" is \"Low vaccination rate\" and \"Access to Healthcare\" is \"Limited access\": what is the probability that \"Covid-19 Mortality in Moscow\" is \"High mortality rate\" (rather than \"Low mortality rate\")?\n15. when \"Implementation of Public Health Measures\" is \"Effective implementation\" and \"Vaccination Rate in Moscow\" is \"Low vaccination rate\" and \"Access to Healthcare\" is \"Wide access\": what is the probability that \"Covid-19 Mortality in Moscow\" is \"High mortality rate\" (rather than \"Low mortality rate\")?\n16. when \"Implementation of Public Health Measures\" is \"Effective implementation\" and \"Vaccination Rate in Moscow\" is \"High vaccination rate\" and \"Access to Healthcare\" is \"Limited access\": what is the probability that \"Covid-19 Mortality in Moscow\" is \"High mortality rate\" (rather than \"Low mortality rate\")?\n17. when \"Implementation of Public Health Measures\" is \"Effective implementation\" and \"Vaccination Rate in Moscow\" is \"High vaccination rate\" and \"Access to Healthcare\" is \"Wide access\": what is the probability that \"Covid-19 Mortality in Moscow\" is \"High mortality rate\" (rather than \"Low mortality rate\")?", "descriptions": "\"Economic Status of Moscow\" means \"Economic status and resources of Moscow\"\n\"Vaccination Rate in Moscow\" means \"Vaccination rate against Covid-19 in Moscow\"\n\"Healthcare System Capacity\" means \"Capacity and efficiency of healthcare system in Moscow\"\n\"Implementation of Public Health Measures\" means \"Effectiveness of public health measures in Moscow\"\n\"Access to Healthcare\" means \"Access to healthcare services in Moscow\"\n\"Covid-19 Mortality in Moscow\" means \"Mortality rate due to Covid-19 in Moscow\"", "stats": "We have a causal bayes net based on the following article:\n\n```\nTitle: Covid-19. Record deaths in Moscow, Russia overtaken by the delta variant - Ouest-France\nDescription: None\nOriginal Language: French\n```\n\nNow we would like to estimate the probabilities of certain events.\n\nUsing commonsense, estimate the probabilities of the following events:\n\n1. what is the probability that \"Economic Status of Moscow\" is \"Good economic status\" (rather than \"Poor economic status\")?\n2. when \"Economic Status of Moscow\" is \"Poor economic status\": what is the probability that \"Vaccination Rate in Moscow\" is \"High vaccination rate\" (rather than \"Low vaccination rate\")?\n3. when \"Economic Status of Moscow\" is \"Good economic status\": what is the probability that \"Vaccination Rate in Moscow\" is \"High vaccination rate\" (rather than \"Low vaccination rate\")?\n4. when \"Economic Status of Moscow\" is \"Poor economic status\": what is the probability that \"Healthcare System Capacity\" is \"Adequate capacity\" (rather than \"Inadequate capacity\")?\n5. when \"Economic Status of Moscow\" is \"Good economic status\": what is the probability that \"Healthcare System Capacity\" is \"Adequate capacity\" (rather than \"Inadequate capacity\")?\n6. when \"Healthcare System Capacity\" is \"Inadequate capacity\": what is the probability that \"Implementation of Public Health Measures\" is \"Effective implementation\" (rather than \"No or poor implementation\")?\n7. when \"Healthcare System Capacity\" is \"Adequate capacity\": what is the probability that \"Implementation of Public Health Measures\" is \"Effective implementation\" (rather than \"No or poor implementation\")?\n8. when \"Healthcare System Capacity\" is \"Inadequate capacity\": what is the probability that \"Access to Healthcare\" is \"Wide access\" (rather than \"Limited access\")?\n9. when \"Healthcare System Capacity\" is \"Adequate capacity\": what is the probability that \"Access to Healthcare\" is \"Wide access\" (rather than \"Limited access\")?\n10. when \"Implementation of Public Health Measures\" is \"No or poor implementation\" and \"Vaccination Rate in Moscow\" is \"Low vaccination rate\" and \"Access to Healthcare\" is \"Limited access\": what is the probability that \"Covid-19 Mortality in Moscow\" is \"High mortality rate\" (rather than \"Low mortality rate\")?\n11. when \"Implementation of Public Health Measures\" is \"No or poor implementation\" and \"Vaccination Rate in Moscow\" is \"Low vaccination rate\" and \"Access to Healthcare\" is \"Wide access\": what is the probability that \"Covid-19 Mortality in Moscow\" is \"High mortality rate\" (rather than \"Low mortality rate\")?\n12. when \"Implementation of Public Health Measures\" is \"No or poor implementation\" and \"Vaccination Rate in Moscow\" is \"High vaccination rate\" and \"Access to Healthcare\" is \"Limited access\": what is the probability that \"Covid-19 Mortality in Moscow\" is \"High mortality rate\" (rather than \"Low mortality rate\")?\n13. when \"Implementation of Public Health Measures\" is \"No or poor implementation\" and \"Vaccination Rate in Moscow\" is \"High vaccination rate\" and \"Access to Healthcare\" is \"Wide access\": what is the probability that \"Covid-19 Mortality in Moscow\" is \"High mortality rate\" (rather than \"Low mortality rate\")?\n14. when \"Implementation of Public Health Measures\" is \"Effective implementation\" and \"Vaccination Rate in Moscow\" is \"Low vaccination rate\" and \"Access to Healthcare\" is \"Limited access\": what is the probability that \"Covid-19 Mortality in Moscow\" is \"High mortality rate\" (rather than \"Low mortality rate\")?\n15. when \"Implementation of Public Health Measures\" is \"Effective implementation\" and \"Vaccination Rate in Moscow\" is \"Low vaccination rate\" and \"Access to Healthcare\" is \"Wide access\": what is the probability that \"Covid-19 Mortality in Moscow\" is \"High mortality rate\" (rather than \"Low mortality rate\")?\n16. when \"Implementation of Public Health Measures\" is \"Effective implementation\" and \"Vaccination Rate in Moscow\" is \"High vaccination rate\" and \"Access to Healthcare\" is \"Limited access\": what is the probability that \"Covid-19 Mortality in Moscow\" is \"High mortality rate\" (rather than \"Low mortality rate\")?\n17. when \"Implementation of Public Health Measures\" is \"Effective implementation\" and \"Vaccination Rate in Moscow\" is \"High vaccination rate\" and \"Access to Healthcare\" is \"Wide access\": what is the probability that \"Covid-19 Mortality in Moscow\" is \"High mortality rate\" (rather than \"Low mortality rate\")?\n\nWhere the variables are defined as:\n\"Economic Status of Moscow\" means \"Economic status and resources of Moscow\"\n\"Vaccination Rate in Moscow\" means \"Vaccination rate against Covid-19 in Moscow\"\n\"Healthcare System Capacity\" means \"Capacity and efficiency of healthcare system in Moscow\"\n\"Implementation of Public Health Measures\" means \"Effectiveness of public health measures in Moscow\"\n\"Access to Healthcare\" means \"Access to healthcare services in Moscow\"\n\"Covid-19 Mortality in Moscow\" means \"Mortality rate due to Covid-19 in Moscow\"\n\nFor each question above, answer with the lower and upper bound estimates of the probabilities as a python dictionary where the key corresponds to the question index in exactly the following format:\n\n```python\nprobabilities = {\n  1: [0.3, 0.4],\n  ...\n}\n```\n\nAnswer concisely and precisely in the desired format.", "probs": {"1": [0.4, 0.6], "2": [0.2, 0.4], "3": [0.6, 0.8], "4": [0.2, 0.4], "5": [0.7, 0.9], "6": [0.3, 0.5], "7": [0.6, 0.8], "8": [0.1, 0.3], "9": [0.7, 0.9], "10": [0.7, 0.9], "11": [0.6, 0.8], "12": [0.6, 0.8], "13": [0.5, 0.7], "14": [0.5, 0.7], "15": [0.4, 0.6], "16": [0.3, 0.5], "17": [0.2, 0.4]}}