{"seed": 6805333, "article": {"ID": 6805333, "title": "To reduce the risk of heart attack and stroke, 150 grams of these 2 fruits per week could help us - Stock Market Projections", "description": "The symbolism associates economic luck and iron health with dried fruit. Especially in Northern European countries, this bond is deeply felt, and not", "content": "The symbolism associates economic luck and iron health with dried fruit. Especially in Northern European countries, this bond is deeply felt, and not by chance. Behind legends and myths, as often\u2026 [+2766 chars]", "language": "it"}, "title": "To reduce the risk of heart attack and stroke, 150 grams of these 2 fruits per week could help us - Stock Market Projections", "description": "The symbolism associates economic luck and iron health with dried fruit. Especially in Northern European countries, this bond is deeply felt, and not", "language": "Italian", "spark": "Title: To reduce the risk of heart attack and stroke, 150 grams of these 2 fruits per week could help us - Stock Market Projections\nDescription: The symbolism associates economic luck and iron health with dried fruit. Especially in Northern European countries, this bond is deeply felt, and not\nOriginal Language: Italian", "setting": "We are interested in building a causal model based on the explicit and implicit assumptions contained in the specified article and then using causal inference to evaluate the reasoning. Answer the following questions to design an interesting, simple, and most importantly realistic causal model from a news article.\n\nTo help understand the instructions here are some tips:\n- all variables are always binary and (at least in principle) measurable, so when creating and selecting variables, make sure it is reasonable to treat them as binary\n- whenever you propose a variable, make sure to define the meaning of each value it can take, and mention whether it is observable or not\n- outcome variables are always observable\n- treatment variables are always observable and intervenable, that means it must be possible to (at least in principle) change their value if desired\n- confounder variables may or may not be observable, and should always have at least two causal children (for example, a treatment and outcome variable) and no causal parents\n- mediator variables may or may not be observable, and should always have at least one causal parent (for example, a treatment variable) and at least one causal child (for example, the outcome variable)\n- collider variables may or may not be observable, and should always have at least two causal parents (for example, a treatment and outcome variable) and no causal children\n\nAnswer concisely and precisely in the desired format. Carefully complete each of these tasks in order.\n\n1. Write a short description of what the article is about and what causal model make inform the reasoning behind an argument the might make.\n2. Propose 1 outcome variable that the news article is either implicitly or explicitly addressing that people are most likely to be interested in studying, especially if people tend to have misconceptions about it\n3. Propose 2 treatment variables that either directly or indirectly affect the selected outcome variable and are the most interesting to study\n4. Propose 3 confounder variables that affect some reasonable combination of the outcome and treatment variables\n5. Propose 3 mediator variables that affect and are affected by some reasonable combination of any other variables\n6. Propose 2 collider variables that are affected by some reasonable combination of any other variables\n\nHere is the beginning of the news article:\n```\nTitle: To reduce the risk of heart attack and stroke, 150 grams of these 2 fruits per week could help us - Stock Market Projections\nDescription: The symbolism associates economic luck and iron health with dried fruit. Especially in Northern European countries, this bond is deeply felt, and not\nOriginal Language: Italian\n```\n\nThe variables and causal graph should, where possible, use specific details such as names and locations mentioned in the article. Also, generally the variable value \"0\" should correspond to the negative, neutral, or control while the value \"1\" should correspond to the positive choice or active value.\n\nTake a deep breath and think step-by-step about how you will do this.", "graph": "1. From all proposed confounder, mediator, and collider variables, select between 4-6 variables that are most interesting to study and together with the treatment and outcome variables result in a realistic interesting causal graph. Important: Make sure the causal graph is a DAG and that no node has more than TWO parents!\n2.  List all the edges in the causal graph, and make sure to mention which edges are observable and which are not.\n3. Provide a python list called `nodes` of all the nodes in the proposed graph. For each node, provide the following information in the form of a python dict:\n- `name`: the name of the variable\n- `description`: a short description of the variable\n- `type`: the type of the variable, which can be one of the following: `outcome`, `treatment`, `confounder`, `mediator`, `collider`\n- `observed`: a boolean value indicating whether the variable is observable or not\n- `values`: a python list of the descriptions of the values the variable can take (corresponding to the index)\n- `parents`: a python list of the names of the parents of the variable (make sure they match the corresponding `name` field of the parent nodes, and remember, there should not be more than TWO parents for any node)\n\nTake a deep breath and think step-by-step about how you will do this.", "nodes": [{"name": "Lifestyle Habits", "description": "Individual's general lifestyle habits", "type": "confounder", "observed": true, "values": ["Unhealthy habits", "Healthy habits"], "parents": []}, {"name": "Health Awareness", "description": "Awareness of health-related information and practices", "type": "mediator", "observed": true, "values": ["Low awareness", "High awareness"], "parents": ["Lifestyle Habits"]}, {"name": "Fruit Consumption", "description": "Consumption of fruits weekly", "type": "treatment", "observed": true, "values": ["< 150 grams", ">= 150 grams"], "parents": ["Lifestyle Habits", "Health Awareness"]}, {"name": "Type of Fruit Consumed", "description": "Type of fruits consumed, specified or others", "type": "treatment", "observed": true, "values": ["Other fruits", "Specified fruits"], "parents": []}, {"name": "Cardiovascular Health", "description": "Overall cardiovascular health status", "type": "outcome", "observed": true, "values": ["Poor", "Good"], "parents": ["Lifestyle Habits", "Fruit Consumption", "Type of Fruit Consumed"]}, {"name": "Perceived Health Status", "description": "Individual's perception of their health status", "type": "collider", "observed": true, "values": ["Perceived as Poor", "Perceived as Good"], "parents": ["Cardiovascular Health", "Health Awareness"]}], "questions": "1. what is the probability that \"Lifestyle Habits\" is \"Healthy habits\" (rather than \"Unhealthy habits\")?\n2. when \"Lifestyle Habits\" is \"Unhealthy habits\": what is the probability that \"Health Awareness\" is \"High awareness\" (rather than \"Low awareness\")?\n3. when \"Lifestyle Habits\" is \"Healthy habits\": what is the probability that \"Health Awareness\" is \"High awareness\" (rather than \"Low awareness\")?\n4. when \"Lifestyle Habits\" is \"Unhealthy habits\" and \"Health Awareness\" is \"Low awareness\": what is the probability that \"Fruit Consumption\" is \">= 150 grams\" (rather than \"< 150 grams\")?\n5. when \"Lifestyle Habits\" is \"Unhealthy habits\" and \"Health Awareness\" is \"High awareness\": what is the probability that \"Fruit Consumption\" is \">= 150 grams\" (rather than \"< 150 grams\")?\n6. when \"Lifestyle Habits\" is \"Healthy habits\" and \"Health Awareness\" is \"Low awareness\": what is the probability that \"Fruit Consumption\" is \">= 150 grams\" (rather than \"< 150 grams\")?\n7. when \"Lifestyle Habits\" is \"Healthy habits\" and \"Health Awareness\" is \"High awareness\": what is the probability that \"Fruit Consumption\" is \">= 150 grams\" (rather than \"< 150 grams\")?\n8. what is the probability that \"Type of Fruit Consumed\" is \"Specified fruits\" (rather than \"Other fruits\")?\n9. when \"Lifestyle Habits\" is \"Unhealthy habits\" and \"Fruit Consumption\" is \"< 150 grams\" and \"Type of Fruit Consumed\" is \"Other fruits\": what is the probability that \"Cardiovascular Health\" is \"Good\" (rather than \"Poor\")?\n10. when \"Lifestyle Habits\" is \"Unhealthy habits\" and \"Fruit Consumption\" is \"< 150 grams\" and \"Type of Fruit Consumed\" is \"Specified fruits\": what is the probability that \"Cardiovascular Health\" is \"Good\" (rather than \"Poor\")?\n11. when \"Lifestyle Habits\" is \"Unhealthy habits\" and \"Fruit Consumption\" is \">= 150 grams\" and \"Type of Fruit Consumed\" is \"Other fruits\": what is the probability that \"Cardiovascular Health\" is \"Good\" (rather than \"Poor\")?\n12. when \"Lifestyle Habits\" is \"Unhealthy habits\" and \"Fruit Consumption\" is \">= 150 grams\" and \"Type of Fruit Consumed\" is \"Specified fruits\": what is the probability that \"Cardiovascular Health\" is \"Good\" (rather than \"Poor\")?\n13. when \"Lifestyle Habits\" is \"Healthy habits\" and \"Fruit Consumption\" is \"< 150 grams\" and \"Type of Fruit Consumed\" is \"Other fruits\": what is the probability that \"Cardiovascular Health\" is \"Good\" (rather than \"Poor\")?\n14. when \"Lifestyle Habits\" is \"Healthy habits\" and \"Fruit Consumption\" is \"< 150 grams\" and \"Type of Fruit Consumed\" is \"Specified fruits\": what is the probability that \"Cardiovascular Health\" is \"Good\" (rather than \"Poor\")?\n15. when \"Lifestyle Habits\" is \"Healthy habits\" and \"Fruit Consumption\" is \">= 150 grams\" and \"Type of Fruit Consumed\" is \"Other fruits\": what is the probability that \"Cardiovascular Health\" is \"Good\" (rather than \"Poor\")?\n16. when \"Lifestyle Habits\" is \"Healthy habits\" and \"Fruit Consumption\" is \">= 150 grams\" and \"Type of Fruit Consumed\" is \"Specified fruits\": what is the probability that \"Cardiovascular Health\" is \"Good\" (rather than \"Poor\")?\n17. when \"Cardiovascular Health\" is \"Poor\" and \"Health Awareness\" is \"Low awareness\": what is the probability that \"Perceived Health Status\" is \"Perceived as Good\" (rather than \"Perceived as Poor\")?\n18. when \"Cardiovascular Health\" is \"Poor\" and \"Health Awareness\" is \"High awareness\": what is the probability that \"Perceived Health Status\" is \"Perceived as Good\" (rather than \"Perceived as Poor\")?\n19. when \"Cardiovascular Health\" is \"Good\" and \"Health Awareness\" is \"Low awareness\": what is the probability that \"Perceived Health Status\" is \"Perceived as Good\" (rather than \"Perceived as Poor\")?\n20. when \"Cardiovascular Health\" is \"Good\" and \"Health Awareness\" is \"High awareness\": what is the probability that \"Perceived Health Status\" is \"Perceived as Good\" (rather than \"Perceived as Poor\")?", "descriptions": "\"Lifestyle Habits\" means \"Individual's general lifestyle habits\"\n\"Health Awareness\" means \"Awareness of health-related information and practices\"\n\"Fruit Consumption\" means \"Consumption of fruits weekly\"\n\"Type of Fruit Consumed\" means \"Type of fruits consumed, specified or others\"\n\"Cardiovascular Health\" means \"Overall cardiovascular health status\"\n\"Perceived Health Status\" means \"Individual's perception of their health status\"", "stats": "We have a causal bayes net based on the following article:\n\n```\nTitle: To reduce the risk of heart attack and stroke, 150 grams of these 2 fruits per week could help us - Stock Market Projections\nDescription: The symbolism associates economic luck and iron health with dried fruit. Especially in Northern European countries, this bond is deeply felt, and not\nOriginal Language: Italian\n```\n\nNow we would like to estimate the probabilities of certain events.\n\nUsing commonsense, estimate the probabilities of the following events:\n\n1. what is the probability that \"Lifestyle Habits\" is \"Healthy habits\" (rather than \"Unhealthy habits\")?\n2. when \"Lifestyle Habits\" is \"Unhealthy habits\": what is the probability that \"Health Awareness\" is \"High awareness\" (rather than \"Low awareness\")?\n3. when \"Lifestyle Habits\" is \"Healthy habits\": what is the probability that \"Health Awareness\" is \"High awareness\" (rather than \"Low awareness\")?\n4. when \"Lifestyle Habits\" is \"Unhealthy habits\" and \"Health Awareness\" is \"Low awareness\": what is the probability that \"Fruit Consumption\" is \">= 150 grams\" (rather than \"< 150 grams\")?\n5. when \"Lifestyle Habits\" is \"Unhealthy habits\" and \"Health Awareness\" is \"High awareness\": what is the probability that \"Fruit Consumption\" is \">= 150 grams\" (rather than \"< 150 grams\")?\n6. when \"Lifestyle Habits\" is \"Healthy habits\" and \"Health Awareness\" is \"Low awareness\": what is the probability that \"Fruit Consumption\" is \">= 150 grams\" (rather than \"< 150 grams\")?\n7. when \"Lifestyle Habits\" is \"Healthy habits\" and \"Health Awareness\" is \"High awareness\": what is the probability that \"Fruit Consumption\" is \">= 150 grams\" (rather than \"< 150 grams\")?\n8. what is the probability that \"Type of Fruit Consumed\" is \"Specified fruits\" (rather than \"Other fruits\")?\n9. when \"Lifestyle Habits\" is \"Unhealthy habits\" and \"Fruit Consumption\" is \"< 150 grams\" and \"Type of Fruit Consumed\" is \"Other fruits\": what is the probability that \"Cardiovascular Health\" is \"Good\" (rather than \"Poor\")?\n10. when \"Lifestyle Habits\" is \"Unhealthy habits\" and \"Fruit Consumption\" is \"< 150 grams\" and \"Type of Fruit Consumed\" is \"Specified fruits\": what is the probability that \"Cardiovascular Health\" is \"Good\" (rather than \"Poor\")?\n11. when \"Lifestyle Habits\" is \"Unhealthy habits\" and \"Fruit Consumption\" is \">= 150 grams\" and \"Type of Fruit Consumed\" is \"Other fruits\": what is the probability that \"Cardiovascular Health\" is \"Good\" (rather than \"Poor\")?\n12. when \"Lifestyle Habits\" is \"Unhealthy habits\" and \"Fruit Consumption\" is \">= 150 grams\" and \"Type of Fruit Consumed\" is \"Specified fruits\": what is the probability that \"Cardiovascular Health\" is \"Good\" (rather than \"Poor\")?\n13. when \"Lifestyle Habits\" is \"Healthy habits\" and \"Fruit Consumption\" is \"< 150 grams\" and \"Type of Fruit Consumed\" is \"Other fruits\": what is the probability that \"Cardiovascular Health\" is \"Good\" (rather than \"Poor\")?\n14. when \"Lifestyle Habits\" is \"Healthy habits\" and \"Fruit Consumption\" is \"< 150 grams\" and \"Type of Fruit Consumed\" is \"Specified fruits\": what is the probability that \"Cardiovascular Health\" is \"Good\" (rather than \"Poor\")?\n15. when \"Lifestyle Habits\" is \"Healthy habits\" and \"Fruit Consumption\" is \">= 150 grams\" and \"Type of Fruit Consumed\" is \"Other fruits\": what is the probability that \"Cardiovascular Health\" is \"Good\" (rather than \"Poor\")?\n16. when \"Lifestyle Habits\" is \"Healthy habits\" and \"Fruit Consumption\" is \">= 150 grams\" and \"Type of Fruit Consumed\" is \"Specified fruits\": what is the probability that \"Cardiovascular Health\" is \"Good\" (rather than \"Poor\")?\n17. when \"Cardiovascular Health\" is \"Poor\" and \"Health Awareness\" is \"Low awareness\": what is the probability that \"Perceived Health Status\" is \"Perceived as Good\" (rather than \"Perceived as Poor\")?\n18. when \"Cardiovascular Health\" is \"Poor\" and \"Health Awareness\" is \"High awareness\": what is the probability that \"Perceived Health Status\" is \"Perceived as Good\" (rather than \"Perceived as Poor\")?\n19. when \"Cardiovascular Health\" is \"Good\" and \"Health Awareness\" is \"Low awareness\": what is the probability that \"Perceived Health Status\" is \"Perceived as Good\" (rather than \"Perceived as Poor\")?\n20. when \"Cardiovascular Health\" is \"Good\" and \"Health Awareness\" is \"High awareness\": what is the probability that \"Perceived Health Status\" is \"Perceived as Good\" (rather than \"Perceived as Poor\")?\n\nWhere the variables are defined as:\n\"Lifestyle Habits\" means \"Individual's general lifestyle habits\"\n\"Health Awareness\" means \"Awareness of health-related information and practices\"\n\"Fruit Consumption\" means \"Consumption of fruits weekly\"\n\"Type of Fruit Consumed\" means \"Type of fruits consumed, specified or others\"\n\"Cardiovascular Health\" means \"Overall cardiovascular health status\"\n\"Perceived Health Status\" means \"Individual's perception of their health status\"\n\nFor each question above, answer with the lower and upper bound estimates of the probabilities as a python dictionary where the key corresponds to the question index in exactly the following format:\n\n```python\nprobabilities = {\n  1: [0.3, 0.4],\n  ...\n}\n```\n\nAnswer concisely and precisely in the desired format.", "probs": {"1": [0.4, 0.6], "2": [0.1, 0.3], "3": [0.7, 0.9], "4": [0.1, 0.3], "5": [0.3, 0.5], "6": [0.4, 0.6], "7": [0.8, 0.9], "8": [0.4, 0.6], "9": [0.1, 0.3], "10": [0.3, 0.5], "11": [0.2, 0.4], "12": [0.4, 0.6], "13": [0.7, 0.8], "14": [0.8, 0.9], "15": [0.8, 0.9], "16": [0.9, 0.95], "17": [0.3, 0.5], "18": [0.1, 0.3], "19": [0.6, 0.8], "20": [0.8, 0.9]}}